{
    "id": "natures_resurgence",
    "name": "Nature's Resurgence",
    "ec": 5,
    
    "effects":[
        {
            "type": "heal",
            "target": "self",
            "method": "lost_hp",
            "value": 0.25
        },
        {
            "type": "apply_status",
            "id": "regen",
            "target": "self",
            "duration": 2
        }
    ]
}