{
    "id": "verdant_roar",
    "name": "Verdant Roar",
    "ec": 7,
    
    "effects":[
        {
            "type": "attack",
            "target": "enemy",
            "element": "grass",
            "power": 1.3
        },
        {
            "type": "apply_effect",
            "id": "defense_down",
            "target": "enemy",
            "method": "multiply",
            "value": 0.75,
            "duration": 3
        },
        {
            "type": "apply_effect",
            "id": "speed_down",
            "target": "enemy",
            "method": "add",
            "value": 10,
            "duration": 3
        }
    ]
}